{
  "schemaVersion": 1,
  "component": "pinentry-companion",
  "componentVersion": "0.2.0",
  "operation": "uninstall",
  "outcome": "conflict",
  "changed": false,
  "diagnostics": [
    {
      "code": "lifecycle.uninstall.activeConfiguration",
      "severity": "error",
      "message": "The recorded original configuration still invokes the binary being removed.",
      "remediation": "Keep the formula installed; this adopted restore point cannot be made removal-safe by retrying."
    }
  ],
  "state": {
    "transactionState": "notCommitted",
    "safety": "noMutationCommitted"
  }
}
