{
  "schemaVersion": 1,
  "component": "pinentry-companion",
  "componentVersion": "0.2.0",
  "operation": "uninstall",
  "outcome": "ok",
  "changed": true,
  "diagnostics": [
    {
      "code": "lifecycle.uninstall.prepared",
      "severity": "info",
      "message": "Recorded GPG configuration was restored before binary removal."
    }
  ],
  "state": {
    "transactionState": "restored",
    "safety": "compareAndSwapVerified"
  }
}
