{
  "schemaVersion": 1,
  "component": "pinentry-companion",
  "componentVersion": "0.2.1",
  "operation": "setup",
  "outcome": "error",
  "changed": false,
  "diagnostics": [
    {
      "code": "contract.unexpectedLifecycleResult",
      "severity": "error",
      "message": "The lifecycle engine returned a result that is invalid for this operation."
    }
  ],
  "state": {
    "transactionState": "indeterminate",
    "safety": "inspectionRequired"
  }
}
